{
  "id": "my-daily-routine",
  "title": "My daily routine",
  "level": "A0",
  "language": "en",
  "defaultDuration": 50,
  "defaultMode": "all",
  "objectives": [
    "describe morning and evening daily routine actions",
    "tell time with o'clock and half past"
  ],
  "links": {
    "vocabulary": [
      "wake",
      "get",
      "wash",
      "brush",
      "shower",
      "bed"
    ],
    "grammar": [
      {
        "topic_id": "telling-time",
        "manual_url": "https://cosylanguages.github.io/COSYmanuals/manuals/en/grammar/a1/topics/telling-time.html"
      }
    ],
    "communication": [
      {
        "phrase_id": "en:general:daily-routine-talk:i-wake-up-at-seven-o-clock",
        "manual_url": "https://cosylanguages.github.io/COSYmanuals/manuals/en/communication/a1/topics/daily-routine-talk.html"
      }
    ]
  },
  "slides": [
    {
      "id": "my-daily-routine-slide-1",
      "title": "Warm-up & Overview",
      "stage": "warm-up",
      "duration": 50,
      "mode": "all",
      "teacherNotes": [
        {
          "type": "instruction",
          "title": "Stage aim",
          "content": "Greet student and introduce lesson objectives for My daily routine."
        },
        {
          "type": "speech",
          "content": "Welcome to today's lesson: My daily routine! Today we will practice how to describe morning and evening daily routine actions."
        }
      ],
      "elements": [
        {
          "type": "instruction",
          "content": "Lesson Objectives for My daily routine:"
        },
        {
          "type": "blockquote",
          "content": "describe morning and evening daily routine actions; tell time with o'clock and half past"
        }
      ]
    },
    {
      "id": "my-daily-routine-slide-2",
      "title": "Vocabulary & Input",
      "stage": "input",
      "duration": 50,
      "mode": "all",
      "teacherNotes": [
        {
          "type": "instruction",
          "title": "Stage aim",
          "content": "Introduce target vocabulary and key language structures using concept check questions."
        }
      ],
      "elements": [
        {
          "type": "instruction",
          "content": "Review key terms and target language below:"
        },
        {
          "type": "blockquote",
          "content": "Key terms: wake, get, wash, brush, shower, bed"
        }
      ]
    },
    {
      "id": "my-daily-routine-slide-3",
      "title": "Controlled Practice",
      "stage": "controlled-practice",
      "duration": 50,
      "mode": "all",
      "teacherNotes": [
        {
          "type": "instruction",
          "title": "Stage aim",
          "content": "Check understanding through controlled choice exercise."
        }
      ],
      "elements": [
        {
          "type": "instruction",
          "content": "What time does the speaker go to work?"
        },
        {
          "type": "test",
          "options": [
            "eight o'clock",
            "ten o'clock",
            "five o'clock"
          ],
          "answers": [
            "eight o'clock"
          ]
        }
      ]
    },
    {
      "id": "my-daily-routine-slide-4",
      "title": "Reading & Listening Skills",
      "stage": "reading-listening",
      "duration": 50,
      "mode": "all",
      "teacherNotes": [
        {
          "type": "instruction",
          "title": "Stage aim",
          "content": "Develop reading comprehension and listening skills."
        },
        {
          "type": "tapescript",
          "title": "Listening Tapescript",
          "content": "Every morning I wake up early. I shower, brush my teeth, and go to work at half past eight."
        }
      ],
      "elements": [
        {
          "type": "instruction",
          "content": "Read the short passage below (recycling introduced vocabulary):"
        },
        {
          "type": "blockquote",
          "content": "I wake up at seven o'clock. I wash my face and shower. Then I go to work at eight o'clock."
        },
        {
          "type": "instruction",
          "content": "Listening Task: Listen to your teacher / audio prompt and answer the comprehension question."
        }
      ]
    },
    {
      "id": "my-daily-routine-slide-5",
      "title": "Freer Speaking Practice",
      "stage": "freer-practice",
      "duration": 50,
      "mode": "all",
      "teacherNotes": [
        {
          "type": "instruction",
          "title": "Stage aim",
          "content": "Provide communicative speaking practice and personalized interaction."
        }
      ],
      "elements": [
        {
          "type": "instruction",
          "content": "Walk your partner through your morning routine stating exact times."
        }
      ]
    },
    {
      "id": "my-daily-routine-slide-6",
      "title": "Cool-down & Summary",
      "stage": "cool-down",
      "duration": 50,
      "mode": "all",
      "teacherNotes": [
        {
          "type": "instruction",
          "title": "Stage aim",
          "content": "Review key corrections and confirm homework task."
        },
        {
          "type": "speech",
          "content": "Great work today! Remember to review target words in your mobile app before our next class."
        }
      ],
      "elements": [
        {
          "type": "instruction",
          "content": "Lesson Summary & Feedback:"
        },
        {
          "type": "blockquote",
          "content": "Today you practiced: describe morning and evening daily routine actions, tell time with o'clock and half past."
        }
      ]
    }
  ]
}
