{
  "id": "en-pron-a2-03-soft-c-and-soft-g",
  "title": "Soft C (/s/) and Soft G (/dʒ/) Expanded",
  "level": "A2",
  "language": "en",
  "defaultDuration": 50,
  "defaultMode": "all",
  "objectives": [
    "Predict soft C /s/ and soft G /dʒ/ before E, I, Y",
    "Recognize Germanic hard G exceptions (get, give, girl)",
    "Master C and G decoding in multi-syllable words"
  ],
  "slides": [
    {
      "id": "en-pron-a2-03-soft-c-and-soft-g-slide-1",
      "title": "Gabarit 14 Champs — Pedagogical Rule & Structure Fiche",
      "stage": "gabarit-core",
      "duration": 50,
      "mode": "all",
      "teacherNotes": [
        {
          "type": "instruction",
          "title": "Stage aim",
          "content": "Present the pronunciation/reading rule for: Soft C (/s/) and Soft G (/dʒ/) Expanded. Use the 14 Gabarit fields to clarify rule, system, logic, and exceptions."
        },
        {
          "type": "additional",
          "title": "Anticipated Problems & Solutions (CELTA Standard)",
          "content": "⚠️ Problem: Learner applies soft G rule to 'give' and says /dʒɪv/.\n💡 Solution: Memorize 'The 4 Gs': Get, Give, Girl, Gift = Hard /g/!"
        }
      ],
      "elements": [
        {
          "type": "instruction",
          "content": "Gabarit 14 Champs: Soft C (/s/) and Soft G (/dʒ/) Expanded"
        },
        {
          "type": "blockquote",
          "content": "<strong>1. Definition:</strong> C and G change from hard sounds (/k/, /g/) to soft sounds (/s/, /dʒ/) depending on the following vowel."
        },
        {
          "type": "blockquote",
          "content": "<strong>2. Rule:</strong> Before E, I, Y = Soft C (/s/ city, face) and Soft G (/dʒ/ gem, giant). Before A, O, U = Hard C (/k/ cat) and Hard G (/g/ go)."
        },
        {
          "type": "blockquote",
          "content": "<strong>3. Why?</strong> Latin/Romance palatalization altered C and G before front vowels E, I, Y."
        },
        {
          "type": "blockquote",
          "content": "<strong>4. How to recognize?</strong> Check the letter immediately following C or G."
        },
        {
          "type": "blockquote",
          "content": "<strong>5. Common examples:</strong> city, face, cycle, gem, giant, gym vs cat, coat, cup, go, got, gum"
        },
        {
          "type": "blockquote",
          "content": "<strong>6. Counter-examples:</strong> Germanic root words with hard G before E/I: get, give, girl, gift, begin, finger."
        },
        {
          "type": "blockquote",
          "content": "<strong>7. Exceptions:</strong> get /ɡɛt/, give /ɡɪv/, girl /ɡɜːrl/, gift /ɡɪft/ (Germanic hard G exceptions)."
        },
        {
          "type": "blockquote",
          "content": "<strong>8. Common mistakes:</strong> Pronouncing 'city' with /k/ or 'get' with /dʒ/."
        },
        {
          "type": "blockquote",
          "content": "<strong>9. Mnemonic / Hint:</strong> C and G soft before E, I, Y! Soft C is 100% reliable; Soft G has Germanic hard exceptions!"
        },
        {
          "type": "blockquote",
          "content": "<strong>10. Key vocabulary:</strong> soft C, soft G, hard C, hard G, palatalization, Germanic exceptions"
        },
        {
          "type": "blockquote",
          "content": "<strong>11. Frequency:</strong> ★★★★★ (Essential)"
        },
        {
          "type": "blockquote",
          "content": "<strong>12. CEFR Level:</strong> 🟡 A2"
        },
        {
          "type": "blockquote",
          "content": "<strong>13. Associated Visual:</strong> 🍦 Soft ice cream cone for E, I, Y vs Hard rock for A, O, U."
        },
        {
          "type": "blockquote",
          "content": "<strong>14. Key Takeaway:</strong> C/G + E, I, Y = Soft! Remember exceptions: get, give, girl!"
        }
      ]
    },
    {
      "id": "en-pron-a2-03-soft-c-and-soft-g-slide-2",
      "title": "Concept Checking Questions (CCQ)",
      "stage": "ccq-check",
      "duration": 50,
      "mode": "all",
      "teacherNotes": [
        {
          "type": "speech",
          "title": "Teacher CCQ Script",
          "content": "Ask these concept checking questions to verify rule understanding without translation:"
        }
      ],
      "elements": [
        {
          "type": "instruction",
          "content": "Rule Understanding Check (CCQ):"
        },
        {
          "type": "blockquote",
          "content": "<strong>CCQ 1:</strong> What sound does C make before E, I, Y? (/s/ soft sound)"
        },
        {
          "type": "blockquote",
          "content": "<strong>CCQ 2:</strong> Is 'city' pronounced with /k/ or /s/? (/s/ soft C)"
        },
        {
          "type": "blockquote",
          "content": "<strong>CCQ 3:</strong> Why do 'get' and 'girl' have a hard /g/ sound before E and I? (They are Germanic exceptions)"
        }
      ]
    },
    {
      "id": "en-pron-a2-03-soft-c-and-soft-g-slide-3",
      "title": "Controlled Practice & Drill Stage",
      "stage": "controlled-practice",
      "duration": 50,
      "mode": "all",
      "teacherNotes": [
        {
          "type": "instruction",
          "title": "Stage aim",
          "content": "Auditory discrimination, minimal pairs, and guided oral drill repetition."
        }
      ],
      "elements": [
        {
          "type": "instruction",
          "content": "Identify whether C or G is HARD or SOFT:"
        },
        {
          "type": "blockquote",
          "content": "🎯 <strong>Item:</strong> city  ➔  <span style=\"color:#0284c7;\"><strong>Answer / Pronunciation:</strong> Soft C (/s/)</span>"
        },
        {
          "type": "blockquote",
          "content": "🎯 <strong>Item:</strong> gem  ➔  <span style=\"color:#0284c7;\"><strong>Answer / Pronunciation:</strong> Soft G (/dʒ/)</span>"
        },
        {
          "type": "blockquote",
          "content": "🎯 <strong>Item:</strong> girl  ➔  <span style=\"color:#0284c7;\"><strong>Answer / Pronunciation:</strong> Hard G exception (/g/)</span>"
        }
      ]
    }
  ]
}