{
  "id": "fr-pron-a2-02-consonnes-particulieres",
  "title": "Les consonnes particulières (CH, PH, GN, QU, GU, V)",
  "level": "A2",
  "language": "fr",
  "defaultDuration": 50,
  "defaultMode": "all",
  "objectives": [
    "Prononcer les digrammes consonantiques complexes",
    "Plaquer la langue pour GN [ɲ]",
    "Assurer le son chuintant CH [ʃ] et frictatif V [v]"
  ],
  "slides": [
    {
      "id": "fr-pron-a2-02-consonnes-particulieres-slide-1",
      "title": "Gabarit 14 Champs — Fiche Pédagogique Règle & Structure",
      "stage": "gabarit-core",
      "duration": 50,
      "mode": "all",
      "teacherNotes": [
        {
          "type": "instruction",
          "title": "Stage aim",
          "content": "Présenter la règle de prononciation pour : Les consonnes particulières (CH, PH, GN, QU, GU, V). Utiliser les 14 champs du gabarit pour clarifier la règle et la structure."
        },
        {
          "type": "additional",
          "title": "Anticipated Problems & Solutions (CELTA Standard)",
          "content": "⚠️ Erreur : L'apprenant prononce 'qui' comme 'kwee' [kwi].\n💡 Correction : Montrer que U est muet après Q : QU = K !"
        }
      ],
      "elements": [
        {
          "type": "instruction",
          "content": "Gabarit 14 Champs : Les consonnes particulières (CH, PH, GN, QU, GU, V)"
        },
        {
          "type": "blockquote",
          "content": "<strong>1. Définition :</strong> Groupes de consonnes historiques ayant une valeur phonétique unique."
        },
        {
          "type": "blockquote",
          "content": "<strong>2. Règle :</strong> CH = [ʃ] (chat). PH = [f] (photo). GN = [ɲ] (ligne). QU = [k] (qui). GU devant E/I = [g] (guitare). V = [v] (vélo)."
        },
        {
          "type": "blockquote",
          "content": "<strong>3. Pourquoi ?</strong> Conservation des graphies grecques (PH -> phi) et latines (GN -> palatale)."
        },
        {
          "type": "blockquote",
          "content": "<strong>4. Comment reconnaître ?</strong> Groupes de lettres ch, ph, gn, qu, gu, v."
        },
        {
          "type": "blockquote",
          "content": "<strong>5. Exemples courants :</strong> chat [ʃa], photo [foto], ligne [liɲ], qui [ki], guitare [gitaʁ], vélo [velo], château [ʃato], signal [siɲal]"
        },
        {
          "type": "blockquote",
          "content": "<strong>6. Contre-exemples :</strong> CH d'origine grecque dans certains mots savants (chorale [koʁal], orchestre [ɔʁkɛstʁ])."
        },
        {
          "type": "blockquote",
          "content": "<strong>7. Exceptions :</strong> Mots savants où CH se lit [k]."
        },
        {
          "type": "blockquote",
          "content": "<strong>8. Erreurs fréquentes :</strong> Prononcer QU comme [kw] (*kwi pour qui) ou GN comme deux consonnes [g]+[n]."
        },
        {
          "type": "blockquote",
          "content": "<strong>9. Astuce mémorisation :</strong> GN = la langue colle tout son dos contre le plafond de la bouche !"
        },
        {
          "type": "blockquote",
          "content": "<strong>10. Vocabulaire clé :</strong> chat, photo, ligne, qui, guitare, vélo, signal, montagne"
        },
        {
          "type": "blockquote",
          "content": "<strong>11. Fréquence :</strong> ★★★★★ (Indispensable)"
        },
        {
          "type": "blockquote",
          "content": "<strong>12. Niveau CECRL :</strong> 🟡 A2"
        },
        {
          "type": "blockquote",
          "content": "<strong>13. Visuel associé :</strong> 👅 Position de la langue collée pour le son GN [ɲ]."
        },
        {
          "type": "blockquote",
          "content": "<strong>14. À retenir :</strong> GN = [ɲ] (montagne). QU = [k] pur (qui). PH = [f] (photo)."
        }
      ]
    },
    {
      "id": "fr-pron-a2-02-consonnes-particulieres-slide-2",
      "title": "Concept Checking Questions (CCQ)",
      "stage": "ccq-check",
      "duration": 50,
      "mode": "all",
      "teacherNotes": [
        {
          "type": "speech",
          "title": "Teacher CCQ Script",
          "content": "Posez ces questions à l'apprenant pour vérifier la compréhension de la règle sans utiliser de traduction :"
        }
      ],
      "elements": [
        {
          "type": "instruction",
          "content": "Vérification de la règle avec le professeur (CCQ) :"
        },
        {
          "type": "blockquote",
          "content": "<strong>CCQ 1 :</strong> Comment se prononce le groupe GN dans 'montagne' ? ([ɲ])"
        },
        {
          "type": "blockquote",
          "content": "<strong>CCQ 2 :</strong> Prononce-t-on le U dans le mot 'qui' ? (Non, QU = [k] pur)"
        },
        {
          "type": "blockquote",
          "content": "<strong>CCQ 3 :</strong> Quel son fait PH dans 'photo' ? ([f])"
        }
      ]
    },
    {
      "id": "fr-pron-a2-02-consonnes-particulieres-slide-3",
      "title": "Pratique Contrôlée & Exercice Oral",
      "stage": "controlled-practice",
      "duration": 50,
      "mode": "all",
      "teacherNotes": [
        {
          "type": "instruction",
          "title": "Stage aim",
          "content": "Exercice de discrimination auditive, paires minimales et répétition orale guidée."
        }
      ],
      "elements": [
        {
          "type": "instruction",
          "content": "Lisez ces mots à consonne particulière :"
        },
        {
          "type": "blockquote",
          "content": "🎯 <strong>Item :</strong> ligne  ➔  <span style=\"color:#0284c7;\"><strong>Réponse / Prononciation :</strong> [liɲ]</span>"
        },
        {
          "type": "blockquote",
          "content": "🎯 <strong>Item :</strong> qui  ➔  <span style=\"color:#0284c7;\"><strong>Réponse / Prononciation :</strong> [ki]</span>"
        }
      ]
    }
  ]
}