{
  "id": "ru-pron-a2-05-ogo-ego-endings",
  "title": "Произношение окончаний -ОГО / -ЕГО",
  "level": "A2",
  "language": "ru",
  "defaultDuration": 50,
  "defaultMode": "all",
  "objectives": [
    "Заменять букву Г на звук [в] в окончаниях -ого/-его",
    "Применять правило к прилагательным, местоимениям и слову 'сегодня'",
    "Различать окончания и корни с буквой Г"
  ],
  "slides": [
    {
      "id": "ru-pron-a2-05-ogo-ego-endings-slide-1",
      "title": "Gabarit 14 Champs — Карточка правила и структуры",
      "stage": "gabarit-core",
      "duration": 50,
      "mode": "all",
      "teacherNotes": [
        {
          "type": "instruction",
          "title": "Цель этапа",
          "content": "Презентация правила произношения/чтения для: Произношение окончаний -ОГО / -ЕГО. Использование 14 полей габарита для разъяснения правила, системы и исключений."
        },
        {
          "type": "additional",
          "title": "Прогнозируемые ошибки и решения (стандарт CELTA/РКИ)",
          "content": "⚠️ Ошибка: Учащийся читает 'сегодня' как *се-год-ня.\n💡 Решение: Показать исторический состав 'сего дня' -> [с'иво́дн'а]."
        }
      ],
      "elements": [
        {
          "type": "instruction",
          "content": "Габарит 14 полей: Произношение окончаний -ОГО / -ЕГО"
        },
        {
          "type": "blockquote",
          "content": "<strong>1. Определение:</strong> В грамматических окончаниях родительного падежа -ого/-его буква Г произносится как звук [в]."
        },
        {
          "type": "blockquote",
          "content": "<strong>2. Правило:</strong> В окончаниях прилагательных, причастий и местоимений -ого/-его, а также в слове 'сегодня', буква Г произносится как [в]: нового [но́вава], синего [с'и́н'ива], какого [како́ва], его [йиво́], сегодня [с'иво́дн'а]."
        },
        {
          "type": "blockquote",
          "content": "<strong>3. Почему?</strong> Исторический переход ослабленного интервокального [г] в губно-зубной звук [в] в окончаниях."
        },
        {
          "type": "blockquote",
          "content": "<strong>4. Как распознать?</strong> Окончание -ого/-его в формах родительного падежа мужского и среднего рода."
        },
        {
          "type": "blockquote",
          "content": "<strong>5. Примеры:</strong> нового [но́вава], синего [с'и́н'ива], какого [како́ва], его [йиво́], своего [свайиво́], сегодня [с'иво́дн'а]"
        },
        {
          "type": "blockquote",
          "content": "<strong>6. Контрпримеры:</strong> Буква Г в корнях слов (много [мно́га], дорогой [дараго́й], огонёк [оган'о́к] — произносится [г])."
        },
        {
          "type": "blockquote",
          "content": "<strong>7. Исключения:</strong> Слова с корнем -го- (строго, долго — произносится [г])."
        },
        {
          "type": "blockquote",
          "content": "<strong>8. Частые ошибки:</strong> Чтение 'его' с буквальным звуком [г] (*е-го вместо [иво])."
        },
        {
          "type": "blockquote",
          "content": "<strong>9. Подсказка / Мнемоника:</strong> Окончание -ОГО/-ЕГО = читаем [ОВА]/[ЕВА]!"
        },
        {
          "type": "blockquote",
          "content": "<strong>10. Ключевая лексика:</strong> окончание -ого/-его, родительный падеж, замена Г на В, сегодня"
        },
        {
          "type": "blockquote",
          "content": "<strong>11. Частотность:</strong> ★★★★★ (Обязательно)"
        },
        {
          "type": "blockquote",
          "content": "<strong>12. Уровень RKI/CEFR:</strong> 🟡 A2"
        },
        {
          "type": "blockquote",
          "content": "<strong>13. Ассоциированный визуал:</strong> 🔄 Трансформация Г -> В в рамке грамматического окончания."
        },
        {
          "type": "blockquote",
          "content": "<strong>14. Главный вывод:</strong> В окончаниях -ого/-его пишем Г, а читаем [В]! Нового = [но́вава]!"
        }
      ]
    },
    {
      "id": "ru-pron-a2-05-ogo-ego-endings-slide-2",
      "title": "Вопросы для проверки понимания (CCQ)",
      "stage": "ccq-check",
      "duration": 50,
      "mode": "all",
      "teacherNotes": [
        {
          "type": "speech",
          "title": "Скрипт преподавателя (CCQ)",
          "content": "Задайте эти вопросы учащемуся для проверки понимания правила без перевода:"
        }
      ],
      "elements": [
        {
          "type": "instruction",
          "content": "Проверка понимания правила (CCQ):"
        },
        {
          "type": "blockquote",
          "content": "<strong>CCQ 1:</strong> Какой звук произносится на месте буквы Г в слове 'нового'? (Звук [в]: [но́вава])"
        },
        {
          "type": "blockquote",
          "content": "<strong>CCQ 2:</strong> Как произносится слово 'его'? ([йиво́] или [иво́])"
        },
        {
          "type": "blockquote",
          "content": "<strong>CCQ 3:</strong> Произносится ли [в] в слове 'много'? (Нет, в слове 'много' Г входит в корень и читается как [г]: [мно́га])"
        }
      ]
    },
    {
      "id": "ru-pron-a2-05-ogo-ego-endings-slide-3",
      "title": "Контролируемая практика и устные упражнения",
      "stage": "controlled-practice",
      "duration": 50,
      "mode": "all",
      "teacherNotes": [
        {
          "type": "instruction",
          "title": "Цель этапа",
          "content": "Слуховая дифференциация, минимальные пары и управляемая устная отработка."
        }
      ],
      "elements": [
        {
          "type": "instruction",
          "content": "Произнесите формы с правильной заменой Г на [в]:"
        },
        {
          "type": "blockquote",
          "content": "🎯 <strong>Задание:</strong> нового  ➔  <span style=\"color:#0284c7;\"><strong>Ответ / Произношение:</strong> [но́вава]</span>"
        },
        {
          "type": "blockquote",
          "content": "🎯 <strong>Задание:</strong> его  ➔  <span style=\"color:#0284c7;\"><strong>Ответ / Произношение:</strong> [йиво́]</span>"
        },
        {
          "type": "blockquote",
          "content": "🎯 <strong>Задание:</strong> сегодня  ➔  <span style=\"color:#0284c7;\"><strong>Ответ / Произношение:</strong> [с'иво́дн'а]</span>"
        }
      ]
    }
  ]
}