{
  "id": "daily-routine",
  "title": "Daily routine",
  "level": "A1",
  "language": "en",
  "defaultDuration": 50,
  "defaultMode": "all",
  "objectives": [
    "detail full daily schedules with time prepositions",
    "use frequency adverbs in complex routines"
  ],
  "links": {
    "vocabulary": [
      "shower",
      "always",
      "usually",
      "sometimes",
      "never"
    ],
    "grammar": [
      {
        "topic_id": "telling-time",
        "manual_url": "https://cosylanguages.github.io/COSYmanuals/manuals/en/grammar/a1/topics/telling-time.html"
      }
    ],
    "communication": [
      "en:general:daily-routine-talk:i-have-breakfast-in-the-morning"
    ]
  },
  "slides": [
    {
      "id": "daily-routine-slide-1",
      "title": "Warm-up & Overview",
      "stage": "warm-up",
      "duration": 50,
      "mode": "all",
      "teacherNotes": [
        {
          "type": "instruction",
          "title": "Stage aim",
          "content": "Greet student and introduce lesson objectives for Daily routine."
        },
        {
          "type": "speech",
          "content": "Welcome to today's lesson: Daily routine! Today we will practice how to detail full daily schedules with time prepositions."
        }
      ],
      "elements": [
        {
          "type": "instruction",
          "content": "Lesson Objectives for Daily routine:"
        },
        {
          "type": "blockquote",
          "content": "detail full daily schedules with time prepositions; use frequency adverbs in complex routines"
        }
      ]
    },
    {
      "id": "daily-routine-slide-2",
      "title": "Vocabulary & Input",
      "stage": "input",
      "duration": 50,
      "mode": "all",
      "teacherNotes": [
        {
          "type": "instruction",
          "title": "Stage aim",
          "content": "Introduce target vocabulary and key language structures using concept check questions."
        }
      ],
      "elements": [
        {
          "type": "instruction",
          "content": "Review key terms and target language below:"
        },
        {
          "type": "blockquote",
          "content": "Key terms: shower, always, usually, sometimes, never"
        }
      ]
    },
    {
      "id": "daily-routine-slide-3",
      "title": "Controlled Practice",
      "stage": "controlled-practice",
      "duration": 50,
      "mode": "all",
      "teacherNotes": [
        {
          "type": "instruction",
          "title": "Stage aim",
          "content": "Check understanding through controlled choice exercise."
        }
      ],
      "elements": [
        {
          "type": "instruction",
          "content": "Which preposition goes before exact times (e.g. 7 o'clock)?"
        },
        {
          "type": "test",
          "options": [
            "at",
            "in",
            "on"
          ],
          "answers": [
            "at"
          ]
        }
      ]
    },
    {
      "id": "daily-routine-slide-4",
      "title": "Reading & Listening Skills",
      "stage": "reading-listening",
      "duration": 50,
      "mode": "all",
      "teacherNotes": [
        {
          "type": "instruction",
          "title": "Stage aim",
          "content": "Develop reading comprehension and listening skills."
        },
        {
          "type": "tapescript",
          "title": "Listening Tapescript",
          "content": "I usually get up at seven o'clock, have breakfast, and go to work on weekdays."
        }
      ],
      "elements": [
        {
          "type": "instruction",
          "content": "Read the short passage below (recycling introduced vocabulary):"
        },
        {
          "type": "blockquote",
          "content": "My daily routine starts early. I always wake up at six, take a shower, and usually go to work at eight."
        },
        {
          "type": "instruction",
          "content": "Listening Task: Listen to your teacher / audio prompt and answer the comprehension question."
        }
      ]
    },
    {
      "id": "daily-routine-slide-5",
      "title": "Freer Speaking Practice",
      "stage": "freer-practice",
      "duration": 50,
      "mode": "all",
      "teacherNotes": [
        {
          "type": "instruction",
          "title": "Stage aim",
          "content": "Provide communicative speaking practice and personalized interaction."
        }
      ],
      "elements": [
        {
          "type": "instruction",
          "content": "Compare your daily routine with your partner's routine."
        }
      ]
    },
    {
      "id": "daily-routine-slide-6",
      "title": "Cool-down & Summary",
      "stage": "cool-down",
      "duration": 50,
      "mode": "all",
      "teacherNotes": [
        {
          "type": "instruction",
          "title": "Stage aim",
          "content": "Review key corrections and confirm homework task."
        },
        {
          "type": "speech",
          "content": "Great work today! Remember to review target words in your mobile app before our next class."
        }
      ],
      "elements": [
        {
          "type": "instruction",
          "content": "Lesson Summary & Feedback:"
        },
        {
          "type": "blockquote",
          "content": "Today you practiced: detail full daily schedules with time prepositions, use frequency adverbs in complex routines."
        }
      ]
    }
  ]
}