{
  "id": "fr-pron-b2-03-e-caduc-par-registre",
  "title": "Le E caduc selon le registre de langue",
  "level": "B2",
  "language": "fr",
  "defaultDuration": 50,
  "defaultMode": "all",
  "objectives": [
    "Gérer la chute en chaîne des E caducs",
    "Maintenir la clarté consonantique en débit rapide",
    "Distinguer la diction poétique et familière"
  ],
  "slides": [
    {
      "id": "fr-pron-b2-03-e-caduc-par-registre-slide-1",
      "title": "Gabarit 14 Champs — Fiche Pédagogique Règle & Structure",
      "stage": "gabarit-core",
      "duration": 50,
      "mode": "all",
      "teacherNotes": [
        {
          "type": "instruction",
          "title": "Stage aim",
          "content": "Présenter la règle de prononciation pour : Le E caduc selon le registre de langue. Utiliser les 14 champs du gabarit pour clarifier la règle et la structure."
        },
        {
          "type": "additional",
          "title": "Anticipated Problems & Solutions (CELTA Standard)",
          "content": "⚠️ Erreur : L'apprenant bloque sur les suites de consonnes réduites.\n💡 Correction : Travailler la fluidité du groupe consonantique résultant [ʒt]."
        }
      ],
      "elements": [
        {
          "type": "instruction",
          "content": "Gabarit 14 Champs : Le E caduc selon le registre de langue"
        },
        {
          "type": "blockquote",
          "content": "<strong>1. Définition :</strong> Variabilité de la suppression du E caduc (schwa) selon la vitesse et la formalité du discours."
        },
        {
          "type": "blockquote",
          "content": "<strong>2. Règle :</strong> En débit rapide familier, la chute du E s'applique en chaîne tant que la règle des 3 consonnes n'est pas violée (je ne sais pas -> ch'sais pas [ʃɛpa] ; ce que je dis -> c'que j'dis [skəʒdi])."
        },
        {
          "type": "blockquote",
          "content": "<strong>3. Pourquoi ?</strong> Maximiser la vitesse d'élocution informelle."
        },
        {
          "type": "blockquote",
          "content": "<strong>4. Comment reconnaître ?</strong> Enchaînement de petits mots grammaticaux avec E."
        },
        {
          "type": "blockquote",
          "content": "<strong>5. Exemples courants :</strong> je te le dis -> j'te l'dis [ʒtəldi] ; ce que tu veux -> c'que tu veux [skətyvø]"
        },
        {
          "type": "blockquote",
          "content": "<strong>6. Contre-exemples :</strong> Maintien de tous les E en déclamation poétique ou théâtre classique."
        },
        {
          "type": "blockquote",
          "content": "<strong>7. Exceptions :</strong> Maintien du E si la séquence de consonnes devient trop lourde."
        },
        {
          "type": "blockquote",
          "content": "<strong>8. Erreurs fréquentes :</strong> Supprimer trop de E et créer un blocage consonantique imprononçable."
        },
        {
          "type": "blockquote",
          "content": "<strong>9. Astuce mémorisation :</strong> « Un E sur deux saute comme des dominos ! »"
        },
        {
          "type": "blockquote",
          "content": "<strong>10. Vocabulaire clé :</strong> E caduc, schwa, registre, chute, chaîne, domino"
        },
        {
          "type": "blockquote",
          "content": "<strong>11. Fréquence :</strong> ★★★★☆ (Fréquent)"
        },
        {
          "type": "blockquote",
          "content": "<strong>12. Niveau CECRL :</strong> 🔴 B2"
        },
        {
          "type": "blockquote",
          "content": "<strong>13. Visuel associé :</strong> 🀄 Dominos qui tombent : un E sur deux s'efface."
        },
        {
          "type": "blockquote",
          "content": "<strong>14. À retenir :</strong> En débit rapide : 'ce que je dis' devient 'c'que j'dis' !"
        }
      ]
    },
    {
      "id": "fr-pron-b2-03-e-caduc-par-registre-slide-2",
      "title": "Concept Checking Questions (CCQ)",
      "stage": "ccq-check",
      "duration": 50,
      "mode": "all",
      "teacherNotes": [
        {
          "type": "speech",
          "title": "Teacher CCQ Script",
          "content": "Posez ces questions à l'apprenant pour vérifier la compréhension de la règle sans utiliser de traduction :"
        }
      ],
      "elements": [
        {
          "type": "instruction",
          "content": "Vérification de la règle avec le professeur (CCQ) :"
        },
        {
          "type": "blockquote",
          "content": "<strong>CCQ 1 :</strong> Combien de E peuvent tomber de suite si les consonnes le permettent ? (Plusieurs, un sur deux en alternance)"
        },
        {
          "type": "blockquote",
          "content": "<strong>CCQ 2 :</strong> Comment dit-on 'je te le dis' en débit rapide ? ([ʒtəldi] 'j'te l'dis')"
        },
        {
          "type": "blockquote",
          "content": "<strong>CCQ 3 :</strong> Peut-on supprimer tous les E dans 'mercredi prochain' ? (Non, règle des 3 consonnes)"
        }
      ]
    },
    {
      "id": "fr-pron-b2-03-e-caduc-par-registre-slide-3",
      "title": "Pratique Contrôlée & Exercice Oral",
      "stage": "controlled-practice",
      "duration": 50,
      "mode": "all",
      "teacherNotes": [
        {
          "type": "instruction",
          "title": "Stage aim",
          "content": "Exercice de discrimination auditive, paires minimales et répétition orale guidée."
        }
      ],
      "elements": [
        {
          "type": "instruction",
          "content": "Réduisez les phrases suivantes en débit rapide :"
        },
        {
          "type": "blockquote",
          "content": "🎯 <strong>Item :</strong> je te le dis  ➔  <span style=\"color:#0284c7;\"><strong>Réponse / Prononciation :</strong> j'te l'dis [ʒtəldi]</span>"
        }
      ]
    }
  ]
}