{
  "id": "how-do-you-feel-today",
  "title": "How do you feel today?",
  "level": "A0",
  "language": "en",
  "defaultDuration": 50,
  "defaultMode": "all",
  "objectives": [
    "express feelings and emotions using to be + adjective",
    "ask partners about their current emotional state"
  ],
  "links": {
    "vocabulary": [
      "fine",
      "happy",
      "sad",
      "tired",
      "nice",
      "good"
    ],
    "grammar": [
      {
        "topic_id": "to-be",
        "manual_url": "https://cosylanguages.github.io/COSYmanuals/manuals/en/grammar/a1/topics/to-be.html"
      }
    ],
    "communication": [
      "phr_feelings_01"
    ]
  },
  "slides": [
    {
      "id": "how-do-you-feel-today-slide-1",
      "title": "Warm-up & Overview",
      "stage": "warm-up",
      "duration": 50,
      "mode": "all",
      "teacherNotes": [
        {
          "type": "instruction",
          "title": "Stage aim",
          "content": "Greet student and introduce lesson objectives for How do you feel today?."
        },
        {
          "type": "speech",
          "content": "Welcome to today's lesson: How do you feel today?! Today we will practice how to express feelings and emotions using to be + adjective."
        }
      ],
      "elements": [
        {
          "type": "instruction",
          "content": "Lesson Objectives for How do you feel today?:"
        },
        {
          "type": "blockquote",
          "content": "express feelings and emotions using to be + adjective; ask partners about their current emotional state"
        }
      ]
    },
    {
      "id": "how-do-you-feel-today-slide-2",
      "title": "Vocabulary & Input",
      "stage": "input",
      "duration": 50,
      "mode": "all",
      "teacherNotes": [
        {
          "type": "instruction",
          "title": "Stage aim",
          "content": "Introduce target vocabulary and key language structures using concept check questions."
        }
      ],
      "elements": [
        {
          "type": "instruction",
          "content": "Review key terms and target language below:"
        },
        {
          "type": "blockquote",
          "content": "Key terms: fine, happy, sad, tired, nice, good"
        }
      ]
    },
    {
      "id": "how-do-you-feel-today-slide-3",
      "title": "Controlled Practice",
      "stage": "controlled-practice",
      "duration": 50,
      "mode": "all",
      "teacherNotes": [
        {
          "type": "instruction",
          "title": "Stage aim",
          "content": "Check understanding through controlled choice exercise."
        }
      ],
      "elements": [
        {
          "type": "instruction",
          "content": "Complete: 'My brother worked all day and now he is ___.'"
        },
        {
          "type": "test",
          "options": [
            "tired",
            "sunny",
            "small"
          ],
          "answers": [
            "tired"
          ]
        }
      ]
    },
    {
      "id": "how-do-you-feel-today-slide-4",
      "title": "Reading & Listening Skills",
      "stage": "reading-listening",
      "duration": 50,
      "mode": "all",
      "teacherNotes": [
        {
          "type": "instruction",
          "title": "Stage aim",
          "content": "Develop reading comprehension and listening skills."
        },
        {
          "type": "tapescript",
          "title": "Listening Tapescript",
          "content": "Hello! I am feeling very happy today. My sister is sad, but my brother is fine."
        }
      ],
      "elements": [
        {
          "type": "instruction",
          "content": "Read the short passage below (recycling introduced vocabulary):"
        },
        {
          "type": "blockquote",
          "content": "How do you feel today? I am happy and fine. My brother is tired after work, but he is good."
        },
        {
          "type": "instruction",
          "content": "Listening Task: Listen to your teacher / audio prompt and answer the comprehension question."
        }
      ]
    },
    {
      "id": "how-do-you-feel-today-slide-5",
      "title": "Freer Speaking Practice",
      "stage": "freer-practice",
      "duration": 50,
      "mode": "all",
      "teacherNotes": [
        {
          "type": "instruction",
          "title": "Stage aim",
          "content": "Provide communicative speaking practice and personalized interaction."
        }
      ],
      "elements": [
        {
          "type": "instruction",
          "content": "Ask your teacher and classmates how they feel today and share your own feelings."
        }
      ]
    },
    {
      "id": "how-do-you-feel-today-slide-6",
      "title": "Cool-down & Summary",
      "stage": "cool-down",
      "duration": 50,
      "mode": "all",
      "teacherNotes": [
        {
          "type": "instruction",
          "title": "Stage aim",
          "content": "Review key corrections and confirm homework task."
        },
        {
          "type": "speech",
          "content": "Great work today! Remember to review target words in your mobile app before our next class."
        }
      ],
      "elements": [
        {
          "type": "instruction",
          "content": "Lesson Summary & Feedback:"
        },
        {
          "type": "blockquote",
          "content": "Today you practiced: express feelings and emotions using to be + adjective, ask partners about their current emotional state."
        }
      ]
    }
  ]
}