{
  "id": "en-pron-b2-05-clear-and-dark-l",
  "title": "Clear L vs Dark L Allophony",
  "level": "B2",
  "language": "en",
  "defaultDuration": 50,
  "defaultMode": "all",
  "objectives": [
    "Distinguish clear alveolar /l/ and dark velarized /ɫ/",
    "Produce dark L in coda position and before consonants",
    "Master allophonic variation of /l/"
  ],
  "slides": [
    {
      "id": "en-pron-b2-05-clear-and-dark-l-slide-1",
      "title": "Gabarit 14 Champs — Pedagogical Rule & Structure Fiche",
      "stage": "gabarit-core",
      "duration": 50,
      "mode": "all",
      "teacherNotes": [
        {
          "type": "instruction",
          "title": "Stage aim",
          "content": "Present the pronunciation/reading rule for: Clear L vs Dark L Allophony. Use the 14 Gabarit fields to clarify rule, system, logic, and exceptions."
        },
        {
          "type": "additional",
          "title": "Anticipated Problems & Solutions (CELTA Standard)",
          "content": "⚠️ Problem: Learner uses clear L at the end of \"feel\".\n💡 Solution: Raise back of tongue toward throat while saying /l/ to produce dark [ɫ]."
        }
      ],
      "elements": [
        {
          "type": "instruction",
          "content": "Gabarit 14 Champs: Clear L vs Dark L Allophony"
        },
        {
          "type": "blockquote",
          "content": "<strong>1. Definition:</strong> The phoneme /l/ has two major positional variants (allophones) in English."
        },
        {
          "type": "blockquote",
          "content": "<strong>2. Rule:</strong> 1. Clear L [l]: Tongue tip touches alveolar ridge before a vowel (leave, light, play). 2. Dark L [ɫ]: Back of tongue raises toward velum (velarization) at the end of a syllable or before a consonant (full, milk, ball, little)."
        },
        {
          "type": "blockquote",
          "content": "<strong>3. Why?</strong> Position in syllable structure triggers secondary velar articulation at syllable codas."
        },
        {
          "type": "blockquote",
          "content": "<strong>4. How to recognize?</strong> Check if L precedes a vowel (Clear) or comes at coda/before consonant (Dark)."
        },
        {
          "type": "blockquote",
          "content": "<strong>5. Common examples:</strong> Clear L: leave /liːv/, light /laɪt/, play /pleɪ/; Dark L: full /fʊɫ/, milk /mɪɫk/, ball /bɔːɫ/, little /ˈlɪtəɫ/"
        },
        {
          "type": "blockquote",
          "content": "<strong>6. Counter-examples:</strong> Irish/Welsh accents which use Clear L in all positions."
        },
        {
          "type": "blockquote",
          "content": "<strong>7. Exceptions:</strong> Clear L retained when adding vowel suffix (ball -> balling = Clear L)."
        },
        {
          "type": "blockquote",
          "content": "<strong>8. Common mistakes:</strong> Replacing Dark L with /w/ (*miwk for milk) or using Clear L at word end."
        },
        {
          "type": "blockquote",
          "content": "<strong>9. Mnemonic / Hint:</strong> L before vowel = Clear & Light! L at end of word = Dark & Deep!"
        },
        {
          "type": "blockquote",
          "content": "<strong>10. Key vocabulary:</strong> clear L, dark L, allophony, velarization, syllable coda, approximant"
        },
        {
          "type": "blockquote",
          "content": "<strong>11. Frequency:</strong> ★★★★☆ (High)"
        },
        {
          "type": "blockquote",
          "content": "<strong>12. CEFR Level:</strong> 🔵 B2"
        },
        {
          "type": "blockquote",
          "content": "<strong>13. Associated Visual:</strong> 👅 Tongue tip touch (Clear L) vs Tongue back rise (Dark L)."
        },
        {
          "type": "blockquote",
          "content": "<strong>14. Key Takeaway:</strong> L before vowel = Clear! L at end/before consonant = Dark /ɫ/!"
        }
      ]
    },
    {
      "id": "en-pron-b2-05-clear-and-dark-l-slide-2",
      "title": "Concept Checking Questions (CCQ)",
      "stage": "ccq-check",
      "duration": 50,
      "mode": "all",
      "teacherNotes": [
        {
          "type": "speech",
          "title": "Teacher CCQ Script",
          "content": "Ask these concept checking questions to verify rule understanding without translation:"
        }
      ],
      "elements": [
        {
          "type": "instruction",
          "content": "Rule Understanding Check (CCQ):"
        },
        {
          "type": "blockquote",
          "content": "<strong>CCQ 1:</strong> Where is \"clear L\" used? (Before vowels, like \"light\" and \"play\")"
        },
        {
          "type": "blockquote",
          "content": "<strong>CCQ 2:</strong> Where is \"dark L\" used? (At the end of syllables or before consonants, like \"ball\" and \"milk\")"
        },
        {
          "type": "blockquote",
          "content": "<strong>CCQ 3:</strong> What part of the tongue raises for dark L? (The back of the tongue toward the velum)"
        }
      ]
    },
    {
      "id": "en-pron-b2-05-clear-and-dark-l-slide-3",
      "title": "Controlled Practice & Drill Stage",
      "stage": "controlled-practice",
      "duration": 50,
      "mode": "all",
      "teacherNotes": [
        {
          "type": "instruction",
          "title": "Stage aim",
          "content": "Auditory discrimination, minimal pairs, and guided oral drill repetition."
        }
      ],
      "elements": [
        {
          "type": "instruction",
          "content": "Classify as Clear L or Dark L:"
        },
        {
          "type": "blockquote",
          "content": "🎯 <strong>Item:</strong> leaf  ➔  <span style=\"color:#0284c7;\"><strong>Answer / Pronunciation:</strong> Clear L (before vowel)</span>"
        },
        {
          "type": "blockquote",
          "content": "🎯 <strong>Item:</strong> feel  ➔  <span style=\"color:#0284c7;\"><strong>Answer / Pronunciation:</strong> Dark L (syllable coda)</span>"
        },
        {
          "type": "blockquote",
          "content": "🎯 <strong>Item:</strong> milk  ➔  <span style=\"color:#0284c7;\"><strong>Answer / Pronunciation:</strong> Dark L (before consonant)</span>"
        }
      ]
    }
  ]
}