{
  "id": "en-pron-b1-06-ough-and-gh",
  "title": "The OUGH & GH Complex Patterns",
  "level": "B1",
  "language": "en",
  "defaultDuration": 50,
  "defaultMode": "all",
  "objectives": [
    "Decode the 6 primary pronunciations of OUGH",
    "Identify silent GH and /f/-sound GH",
    "Memorize high-frequency OUGH exception vocabulary"
  ],
  "slides": [
    {
      "id": "en-pron-b1-06-ough-and-gh-slide-1",
      "title": "Gabarit 14 Champs — Pedagogical Rule & Structure Fiche",
      "stage": "gabarit-core",
      "duration": 50,
      "mode": "all",
      "teacherNotes": [
        {
          "type": "instruction",
          "title": "Stage aim",
          "content": "Present the pronunciation/reading rule for: The OUGH & GH Complex Patterns. Use the 14 Gabarit fields to clarify rule, system, logic, and exceptions."
        },
        {
          "type": "additional",
          "title": "Anticipated Problems & Solutions (CELTA Standard)",
          "content": "⚠️ Problem: Learner pronounces \"though\" as /θrʌf/.\n💡 Solution: Drill sentence: Though (/oʊ/) it was rough (/ʌf/), he went through (/uː/)."
        }
      ],
      "elements": [
        {
          "type": "instruction",
          "content": "Gabarit 14 Champs: The OUGH & GH Complex Patterns"
        },
        {
          "type": "blockquote",
          "content": "<strong>1. Definition:</strong> OUGH and GH are historical letter combinations with multiple distinct pronunciations."
        },
        {
          "type": "blockquote",
          "content": "<strong>2. Rule:</strong> GH = silent in igh/eigh/augh/ough (light, night, eight, daughter, bought); GH = /f/ in rough, tough, laugh, cough. OUGH has 6 main sounds: 1. /ʌf/ (rough), 2. /ɔː/ (bought), 3. /oʊ/ (though), 4. /uː/ (through), 5. /aʊ/ (bough), 6. /ɒf/ (cough)."
        },
        {
          "type": "blockquote",
          "content": "<strong>3. Why?</strong> Middle English velar fricative /x/ was lost or shifted to /f/ while medieval spelling was retained."
        },
        {
          "type": "blockquote",
          "content": "<strong>4. How to recognize?</strong> Spot letter groups igh, eigh, augh, ough, gh."
        },
        {
          "type": "blockquote",
          "content": "<strong>5. Common examples:</strong> light /laɪt/, eight /eɪt/, daughter /ˈdɔːtər/, rough /rʌf/, bought /bɔːt/, though /ðoʊ/, through /θruː/, cough /kɒf/"
        },
        {
          "type": "blockquote",
          "content": "<strong>6. Counter-examples:</strong> GH at word start where G is hard (ghost /ɡoʊst/)."
        },
        {
          "type": "blockquote",
          "content": "<strong>7. Exceptions:</strong> hiccough (archaic spelling for hiccup /ˈhɪkʌp/)."
        },
        {
          "type": "blockquote",
          "content": "<strong>8. Common mistakes:</strong> Trying to apply a single rule to all OUGH words."
        },
        {
          "type": "blockquote",
          "content": "<strong>9. Mnemonic / Hint:</strong> OUGH has 6 sounds! Memorize \"though, through, rough, cough, thought, bough\"!"
        },
        {
          "type": "blockquote",
          "content": "<strong>10. Key vocabulary:</strong> OUGH pattern, silent GH, velar fricative, Middle English, irregular spelling"
        },
        {
          "type": "blockquote",
          "content": "<strong>11. Frequency:</strong> ★★★★☆ (High)"
        },
        {
          "type": "blockquote",
          "content": "<strong>12. CEFR Level:</strong> 🟠 B1"
        },
        {
          "type": "blockquote",
          "content": "<strong>13. Associated Visual:</strong> 🚦 6-color branch chart showing the 6 pronunciations of OUGH."
        },
        {
          "type": "blockquote",
          "content": "<strong>14. Key Takeaway:</strong> OUGH is irregular! Memorize the top 10 words: though, through, rough, thought..."
        }
      ]
    },
    {
      "id": "en-pron-b1-06-ough-and-gh-slide-2",
      "title": "Concept Checking Questions (CCQ)",
      "stage": "ccq-check",
      "duration": 50,
      "mode": "all",
      "teacherNotes": [
        {
          "type": "speech",
          "title": "Teacher CCQ Script",
          "content": "Ask these concept checking questions to verify rule understanding without translation:"
        }
      ],
      "elements": [
        {
          "type": "instruction",
          "content": "Rule Understanding Check (CCQ):"
        },
        {
          "type": "blockquote",
          "content": "<strong>CCQ 1:</strong> Does \"ough\" sound the same in \"though\" and \"through\"? (No, though = /oʊ/, through = /uː/)"
        },
        {
          "type": "blockquote",
          "content": "<strong>CCQ 2:</strong> How is GH pronounced in \"rough\" and \"cough\"? (/f/ sound)"
        },
        {
          "type": "blockquote",
          "content": "<strong>CCQ 3:</strong> How is GH pronounced in \"light\" and \"bought\"? (Silent)"
        }
      ]
    },
    {
      "id": "en-pron-b1-06-ough-and-gh-slide-3",
      "title": "Controlled Practice & Drill Stage",
      "stage": "controlled-practice",
      "duration": 50,
      "mode": "all",
      "teacherNotes": [
        {
          "type": "instruction",
          "title": "Stage aim",
          "content": "Auditory discrimination, minimal pairs, and guided oral drill repetition."
        }
      ],
      "elements": [
        {
          "type": "instruction",
          "content": "Match OUGH words with their correct sound:"
        },
        {
          "type": "blockquote",
          "content": "🎯 <strong>Item:</strong> though  ➔  <span style=\"color:#0284c7;\"><strong>Answer / Pronunciation:</strong> /oʊ/ (like go)</span>"
        },
        {
          "type": "blockquote",
          "content": "🎯 <strong>Item:</strong> through  ➔  <span style=\"color:#0284c7;\"><strong>Answer / Pronunciation:</strong> /uː/ (like too)</span>"
        },
        {
          "type": "blockquote",
          "content": "🎯 <strong>Item:</strong> rough  ➔  <span style=\"color:#0284c7;\"><strong>Answer / Pronunciation:</strong> /ʌf/ (like stuff)</span>"
        }
      ]
    }
  ]
}