{
  "id": "opposites-attract",
  "title": "Opposites attract",
  "level": "C1",
  "language": "en",
  "defaultDuration": 50,
  "defaultMode": "all",
  "objectives": [
    "discuss relationship dynamics and personality traits",
    "explore advanced C1 vocabulary for describing interpersonal relationships",
    "analyze whether contrasting personalities complement each other"
  ],
  "slides": [
    {
      "id": "slide-1",
      "title": "Lesson Overview",
      "stage": "lead-in",
      "duration": 50,
      "mode": "all",
      "teacherNotes": [
        {
          "type": "instruction",
          "title": "Stage aim",
          "content": "Introduce the topic of attraction between contrasting personality types and establish lesson goals."
        },
        {
          "type": "speech",
          "content": "Do you believe that opposites attract, or do birds of a feather flock together?"
        }
      ],
      "elements": [
        {
          "type": "instruction",
          "content": "Lesson objectives:"
        }
      ]
    },
    {
      "id": "slide-2",
      "title": "Discussion: Attraction Dynamics",
      "stage": "lead-in",
      "duration": 50,
      "mode": "all",
      "teacherNotes": [
        {
          "type": "speech",
          "content": "Ask CCQs: If two traits are complementary, do they fight each other or complete each other?"
        }
      ],
      "elements": [
        {
          "type": "instruction",
          "content": "Discuss the following questions with your teacher"
        }
      ]
    },
    {
      "id": "slide-3",
      "title": "Controlled Practice: Personality Terms",
      "stage": "controlled-practice",
      "duration": 50,
      "mode": "all",
      "teacherNotes": [
        {
          "type": "instruction",
          "content": "Verify understanding of C1 personality adjectives."
        }
      ],
      "elements": [
        {
          "type": "instruction",
          "content": "Select the correct term to complete each statement"
        }
      ]
    },
    {
      "id": "slide-4",
      "title": "Speaking & Case Study",
      "stage": "freer-practice",
      "duration": 80,
      "mode": "group",
      "teacherNotes": [
        {
          "type": "instruction",
          "content": "Facilitate group discussion or 1-on-1 debate on relationship case studies."
        }
      ],
      "elements": [
        {
          "type": "instruction",
          "content": "Analyze the case study and record your response"
        }
      ]
    }
  ]
}
