{
  "id": "ru-pron-c2-01-proper-names-and-toponyms",
  "title": "Произношение имён собственных, топонимов и иноязычных фамилий",
  "level": "C2",
  "language": "ru",
  "defaultDuration": 50,
  "defaultMode": "all",
  "objectives": [
    "Безошибочно произносить сложные русские и заимствованные топонимы",
    "Соблюдать нормы произношения иностранных фамилий",
    "Владеть академической орфоэпией имён собственных"
  ],
  "slides": [
    {
      "id": "ru-pron-c2-01-proper-names-and-toponyms-slide-1",
      "title": "Gabarit 14 Champs — Карточка правила и структуры",
      "stage": "gabarit-core",
      "duration": 50,
      "mode": "all",
      "teacherNotes": [
        {
          "type": "instruction",
          "title": "Цель этапа",
          "content": "Презентация правила произношения/чтения для: Произношение имён собственных, топонимов и иноязычных фамилий. Использование 14 полей габарита для разъяснения правила, системы и исключений."
        },
        {
          "type": "additional",
          "title": "Прогнозируемые ошибки и решения (стандарт CELTA/РКИ)",
          "content": "⚠️ Ошибка: Учащийся произносит географические названия на английский манер.\n💡 Решение: Показать традиционную русскую адаптацию топонимов."
        }
      ],
      "elements": [
        {
          "type": "instruction",
          "content": "Габарит 14 полей: Произношение имён собственных, топонимов и иноязычных фамилий"
        },
        {
          "type": "blockquote",
          "content": "<strong>1. Определение:</strong> Имена собственные и географические названия подчиняются особым традиционным орфоэпическим правилам."
        },
        {
          "type": "blockquote",
          "content": "<strong>2. Правило:</strong> 1. Русские топонимы: Репино [рэ́п'ина], Нижний Новгород [н'и́жн'ий но́вгарат]. 2. Иноязычные имена собственные: Вашингтон [вашынгто́н], Хьюстон [хйу́сто́н], Шекспир [шыксп'и́р]. 3. Заимствованные фамилии часто сохраняют традиционное написание и произношение."
        },
        {
          "type": "blockquote",
          "content": "<strong>3. Почему?</strong> Имена собственные хранят историко-культурную традицию освоения иноязычной лексики."
        },
        {
          "type": "blockquote",
          "content": "<strong>4. Как распознать?</strong> Имена, фамилии и географические названия."
        },
        {
          "type": "blockquote",
          "content": "<strong>5. Примеры:</strong> Вашингтон [вашынгто́н], Хьюстон [хйу́сто́н], Шекспир [шыксп'и́р], Нижний Новгород, Репино, Бальмонт [бальмо́нт]"
        },
        {
          "type": "blockquote",
          "content": "<strong>6. Контрпримеры:</strong> Нарицательные слова, адаптированные по общим правилам."
        },
        {
          "type": "blockquote",
          "content": "<strong>7. Исключения:</strong> Традиционные исторические искажения (Париж вместо *Пари)."
        },
        {
          "type": "blockquote",
          "content": "<strong>8. Частые ошибки:</strong> Попытка прочитать иностранные имена по правилам языка-источника без учёта русской традиции."
        },
        {
          "type": "blockquote",
          "content": "<strong>9. Подсказка / Мнемоника:</strong> Имена собственные требуют знания русской культурной традиции!"
        },
        {
          "type": "blockquote",
          "content": "<strong>10. Ключевая лексика:</strong> топонимы, имена собственные, иноязычные фамилии, традиционная норма, орфоэпия"
        },
        {
          "type": "blockquote",
          "content": "<strong>11. Частотность:</strong> ★★★☆☆ (Специальная)"
        },
        {
          "type": "blockquote",
          "content": "<strong>12. Уровень RKI/CEFR:</strong> ⚫ C2"
        },
        {
          "type": "blockquote",
          "content": "<strong>13. Ассоциированный визуал:</strong> 🗺️ Географическая карта и портреты с правильной транскрипцией."
        },
        {
          "type": "blockquote",
          "content": "<strong>14. Главный вывод:</strong> Имена собственные произносятся по традиционной русской орфоэпической норме!"
        }
      ]
    },
    {
      "id": "ru-pron-c2-01-proper-names-and-toponyms-slide-2",
      "title": "Вопросы для проверки понимания (CCQ)",
      "stage": "ccq-check",
      "duration": 50,
      "mode": "all",
      "teacherNotes": [
        {
          "type": "speech",
          "title": "Скрипт преподавателя (CCQ)",
          "content": "Задайте эти вопросы учащемуся для проверки понимания правила без перевода:"
        }
      ],
      "elements": [
        {
          "type": "instruction",
          "content": "Проверка понимания правила (CCQ):"
        },
        {
          "type": "blockquote",
          "content": "<strong>CCQ 1:</strong> Как произносится фамилия Шекспир в русской традиции? ([шыксп'и́р])"
        },
        {
          "type": "blockquote",
          "content": "<strong>CCQ 2:</strong> Сохраняется ли оригинальное французское произношение в слове 'Париж'? (Нет, используется традиционная русская форма [пари́ш])"
        },
        {
          "type": "blockquote",
          "content": "<strong>CCQ 3:</strong> Как произносится название города Вашингтон? ([вашынгто́н])"
        }
      ]
    },
    {
      "id": "ru-pron-c2-01-proper-names-and-toponyms-slide-3",
      "title": "Контролируемая практика и устные упражнения",
      "stage": "controlled-practice",
      "duration": 50,
      "mode": "all",
      "teacherNotes": [
        {
          "type": "instruction",
          "title": "Цель этапа",
          "content": "Слуховая дифференциация, минимальные пары и управляемая устная отработка."
        }
      ],
      "elements": [
        {
          "type": "instruction",
          "content": "Произнесите имена собственные в соответствии с русской академической нормой:"
        },
        {
          "type": "blockquote",
          "content": "🎯 <strong>Задание:</strong> Шекспир  ➔  <span style=\"color:#0284c7;\"><strong>Ответ / Произношение:</strong> [шыксп'и́р]</span>"
        },
        {
          "type": "blockquote",
          "content": "🎯 <strong>Задание:</strong> Вашингтон  ➔  <span style=\"color:#0284c7;\"><strong>Ответ / Произношение:</strong> [вашынгто́н]</span>"
        },
        {
          "type": "blockquote",
          "content": "🎯 <strong>Задание:</strong> Хьюстон  ➔  <span style=\"color:#0284c7;\"><strong>Ответ / Произношение:</strong> [хйу́сто́н]</span>"
        }
      ]
    }
  ]
}