{
  "id": "fr-pron-a1-02-accent-aigu",
  "title": "L'Accent Aigu (É) et le son [e]",
  "level": "A1",
  "language": "fr",
  "defaultDuration": 50,
  "defaultMode": "all",
  "objectives": [
    "Reconnaître l'accent aigu sur la lettre E",
    "Produire le son fermé [e] avec lèvres étirées",
    "Distinguer é de e muet"
  ],
  "slides": [
    {
      "id": "fr-pron-a1-02-accent-aigu-slide-1",
      "title": "Gabarit 14 Champs — Fiche Pédagogique Règle & Structure",
      "stage": "gabarit-core",
      "duration": 50,
      "mode": "all",
      "teacherNotes": [
        {
          "type": "instruction",
          "title": "Stage aim",
          "content": "Présenter la règle de prononciation pour : L'Accent Aigu (É) et le son [e]. Utiliser les 14 champs du gabarit pour clarifier la règle, le système et les exceptions."
        },
        {
          "type": "additional",
          "title": "Anticipated Problems & Solutions (CELTA Standard)",
          "content": "⚠️ Erreur : L'apprenant ouvre trop la bouche et produit un [ɛ] ouvert (comme dans 'père').\n💡 Correction : Demander de sourire et de rapprocher les mâchoires en étirant les coins des lèvres."
        }
      ],
      "elements": [
        {
          "type": "instruction",
          "content": "Gabarit 14 Champs : L'Accent Aigu (É) et le son [e]"
        },
        {
          "type": "blockquote",
          "content": "<strong>1. Définition :</strong> L'accent aigu (´) se place exclusivement sur la lettre E (É) pour indiquer le son voyelle fermé [e]."
        },
        {
          "type": "blockquote",
          "content": "<strong>2. Règle :</strong> La lettre É se prononce toujours [e] fermé, quelle que soit sa position dans le mot."
        },
        {
          "type": "blockquote",
          "content": "<strong>3. Pourquoi ?</strong> L'accent aigu a été introduit à la Renaissance pour marquer le son fermé [e] issu de la chute de lettres anciennes."
        },
        {
          "type": "blockquote",
          "content": "<strong>4. Comment reconnaître ?</strong> Rechercher la barre montante de gauche à droite sur le E (´)."
        },
        {
          "type": "blockquote",
          "content": "<strong>5. Exemples courants :</strong> café, été, école, étudiant, téléphone, cinéma, télévision, bébé"
        },
        {
          "type": "blockquote",
          "content": "<strong>6. Contre-exemples :</strong> le, de, ce (E sans accent = schwa neutre [ə])."
        },
        {
          "type": "blockquote",
          "content": "<strong>7. Exceptions :</strong> Mots d'emprunt où l'accent est omis dans les majuscules (bien que recommandé en français moderne)."
        },
        {
          "type": "blockquote",
          "content": "<strong>8. Erreurs fréquentes :</strong> Prononcer É comme le E anglais de 'red' [ɛ] au lieu d'un [e] fermé bien tendu."
        },
        {
          "type": "blockquote",
          "content": "<strong>9. Astuce mémorisation :</strong> L'accent AIGU monte vers le ciel comme un sourire étiré !"
        },
        {
          "type": "blockquote",
          "content": "<strong>10. Vocabulaire clé :</strong> café, été, école, étudiant, téléphone, cinéma, bébé, santé"
        },
        {
          "type": "blockquote",
          "content": "<strong>11. Fréquence :</strong> ★★★★★ (Très fréquent)"
        },
        {
          "type": "blockquote",
          "content": "<strong>12. Niveau CECRL :</strong> 🟢 A0-A1"
        },
        {
          "type": "blockquote",
          "content": "<strong>13. Visuel associé :</strong> 🗣️ Schéma buccal : lèvres étirées en sourire léger, langue avancée vers les dents du bas."
        },
        {
          "type": "blockquote",
          "content": "<strong>14. À retenir :</strong> É = [e] fermé. Souriez légèrement et gardez la langue en bas devant !"
        }
      ]
    },
    {
      "id": "fr-pron-a1-02-accent-aigu-slide-2",
      "title": "Concept Checking Questions (CCQ)",
      "stage": "ccq-check",
      "duration": 50,
      "mode": "all",
      "teacherNotes": [
        {
          "type": "speech",
          "title": "Teacher CCQ Script",
          "content": "Posez ces questions à l'apprenant pour vérifier la compréhension de la règle sans utiliser de traduction :"
        }
      ],
      "elements": [
        {
          "type": "instruction",
          "content": "Vérification de la règle avec le professeur (CCQ) :"
        },
        {
          "type": "blockquote",
          "content": "<strong>CCQ 1 :</strong> Sur quelle voyelle peut-on mettre un accent aigu ? (Uniquement sur la lettre E)"
        },
        {
          "type": "blockquote",
          "content": "<strong>CCQ 2 :</strong> Le son [e] de 'café' est-il ouvert ou fermé ? (Fermé)"
        },
        {
          "type": "blockquote",
          "content": "<strong>CCQ 3 :</strong> Dans le mot 'été', les deux É se prononcent-ils de la même façon ? (Oui, [ete])"
        }
      ]
    },
    {
      "id": "fr-pron-a1-02-accent-aigu-slide-3",
      "title": "Pratique Contrôlée & Exercice Oral",
      "stage": "controlled-practice",
      "duration": 50,
      "mode": "all",
      "teacherNotes": [
        {
          "type": "instruction",
          "title": "Stage aim",
          "content": "Exercice de discrimination auditive, paires minimales et répétition orale guidée."
        }
      ],
      "elements": [
        {
          "type": "instruction",
          "content": "Lisez les mots suivants et indiquez si la lettre E se prononce [e] fermé ou [ə] neutre :"
        },
        {
          "type": "blockquote",
          "content": "🎯 <strong>Item :</strong> café  ➔  <span style=\"color:#0284c7;\"><strong>Réponse / Prononciation :</strong> [e] fermé</span>"
        },
        {
          "type": "blockquote",
          "content": "🎯 <strong>Item :</strong> le  ➔  <span style=\"color:#0284c7;\"><strong>Réponse / Prononciation :</strong> [ə] neutre</span>"
        },
        {
          "type": "blockquote",
          "content": "🎯 <strong>Item :</strong> étudiant  ➔  <span style=\"color:#0284c7;\"><strong>Réponse / Prononciation :</strong> [e] fermé</span>"
        }
      ]
    }
  ]
}